ข้อมูลสถิติการจับกุม|คดี|ยาเสพติด| |ประจำปี|งบประมาณ| |2558|
สถิติการรับเรื่องร้องเรียน|การทุจริต|ใน|ภาครัฐ|ของ|สำนักงาน| |ป.|ป.|ท|.|
สรุปผลการดำเนินการมาตรการ|ริบทรัพย์สิน|จาก|คดียาเสพติด| |เดือน| |ม.ค.| |-| |ส.ค.| |ปี| |2558|
ข้อมูลสถิติการคุมประพฤติ|คดีเมาแล้วขับ|ช่วง|เทศกาลปีใหม่|ตั้งแต่| |พ.ศ.| |2549| |-| |พ|.|ศ| |2559|
ข้อมูลสถิติ|คดีสืบเสาะ|และ|พินิจ|ของ|สำนักงานคุมประพฤติ|ทั่วประเทศ| |ปีงบประมาณ| |2546| |-| |2559| |กรมคุมประพฤติ|
สถิติแสดงผล|การดำเนินงาน|ด้านปราบปรามการทุจริต|ของ|คณะกรรมการ| |ป.ป.ช.| |(|ตั้งแต่|ปีงบประมาณ| |พ.ศ.| |2550| |-| |2556)|
ข้อมูลสถิติ|คดีฟื้นฟู|ฯ| |จําแนก|ชนิดยาเสพติด|ของ|สํานักงานคุมประพฤติ|ทั่วประเทศ| |ปีงบประมาณ| |2550| |-| |2559|
ข้อมูลสถิติการคุมความประพฤติ|คดีเมาแล้วขับ| |ช่วง|เทศกาลสงกรานต์| |ตั้งแต่| |พ.ศ.| |2549| |-| |พ.ศ.| |2558|
ข้อมูลสถิติงานควบคุม|และ|สอดส่อง| |จำแนก|ภารกิจ| |เพศ| |อายุ|ของ|ผู้ถูกคุม|ประพฤติ| |ของ|สํานักงานคุมประพฤติ|ทั่วประเทศ| |ปีงบประมาณ|2550| |-| |2559|
ข้อมูลสถิติ|คดีตรวจพิสูจน์| |จําแนก|ชนิดยาเสพติด|ของ|สํานักงานคุมประพฤติ|ทั่วประเทศ| |ปีงบประมาณ| |2550| |-| |2559|
ข้อมูลสถิติ|คดีควบคุม|และ|สอดส่อง|ของ|สํานักงานคุมประพฤติ| |กรมคุมประพฤติ| |ปีงบประมาณ| |2546| |-| |2559|
ข้อมูลสถิติรายงาน|อายุ|และ|เพศ|ของ|จําเลย| |งานสืบเสาะและพินิจ| |ของ|สํานักงานคุมประพฤติ|ทั่วประเทศ| |ประจํา|ปีงบประมาณ|2550| |-| |2559| |กรมคุมประพฤติ|
สถิติผลการดำเนินงาน|ด้านการตรวจสอบทรัพย์สิน|และ|หนี้สิน| |(|ตั้งแต่|ปีงบประมาณ| |พ.ศ.| |2550| |-| |2556)|
ข้อมูลสถิติการคุมประพฤติทั้งผู้ใหญ่|และ|เด็ก|ตั้งแต่|ปี| |พ.ศ.| |2548| |-| |31| |มกราคม| |2559|
ข้อมูลสถิติ|คดีควบคุม|และ|สอดส่อง|จําแนก|ตาม|ฐานความผิด|ของ|สํานักงานคุมประพฤติ|ทั่วประเทศ| |ปีงบประมาณ| |2553| |-| |2559|
ข้อมูลสถิติ|คดีฟื้นฟู|ฯ| |จําแนก|ตาม|ฐานความผิด|ของ|สํานักงานคุมประพฤติ|ทั่วประเทศ| |ปีงบประมาณ| |2550| |-| |2559|
